subject_area,subj_code,title,number,section_ids
Aerospace Studies,AERO ST,Air Force Leadership Studies,130A,{5864046}
Aerospace Studies,AERO ST,Air Force Leadership Studies,130B,{3109}
Aerospace Studies,AERO ST,Heritage and Values,1A,"{5861351,5861308}"
Aerospace Studies,AERO ST,Heritage and Values,1B,"{7,8}"
Aerospace Studies,AERO ST,Individual Studies in Aerospace Studies,197,"{5860748,5860831}"
Aerospace Studies,AERO ST,Leadership Laboratory,A,"{5861322,4992}"
Aerospace Studies,AERO ST,National Security Affairs/Preparation for Active Duty,140A,{5868211}
Aerospace Studies,AERO ST,National Security Affairs/Preparation for Active Duty,140B,{3276}
Aerospace Studies,AERO ST,Team and Leadership Fundamentals,20A,"{5864131,5864080}"
Aerospace Studies,AERO ST,Team and Leadership Fundamentals,20B,"{3172,1955}"
African American Studies,AF AMER,African American Literature from Harlem Renaissance to 1960s,M104B,{1537}
African American Studies,AF AMER,African American Literature of 1960s and 1970s,M104C,{5860611}
African American Studies,AF AMER,African American Musical Heritage,M12A,{684}
African American Studies,AF AMER,African American Theater History: Slavery to Mid-1800s,M103A,{2079}
African American Studies,AF AMER,Borders and Black Bodies,19,{2242}
African American Studies,AF AMER,"Culture, Communications, and Human Development Research Group Seminars",M194C,{5866355}
African American Studies,AF AMER,"Culture, Gender, and Human Development Research Group Seminars",M194B,{5866993}
African American Studies,AF AMER,Early African American Literature,M104A,{5865378}
African American Studies,AF AMER,Elementary Amharic,M9A,{5860583}
African American Studies,AF AMER,Elementary Amharic,M9B,{2626}
African American Studies,AF AMER,Elementary Yoruba,M7A,{5863052}
African American Studies,AF AMER,Elementary Yoruba,M7B,{2733}
African American Studies,AF AMER,Ellingtonia,M111,{5863439}
African American Studies,AF AMER,History of Africa to 1800,M10A,{1645}
African American Studies,AF AMER,Honors Research in Afro-American Studies,198,{23}
African American Studies,AF AMER,Individual Studies for USIE Facilitators,188SA,{5863604}
African American Studies,AF AMER,Individual Studies for USIE Facilitators,188SB,{2153}
African American Studies,AF AMER,Individual Studies in Afro-American Studies,197,{5860616}
African American Studies,AF AMER,Introduction to Afro-American History,M158B,{541}
African American Studies,AF AMER,Introduction to Black Studies,1,{5861522}
African American Studies,AF AMER,Issues in Pan-African Biography and Autobiography,105B,{5862511}
African American Studies,AF AMER,Leadership and Student-Initiated Retention,M18,{2236}
African American Studies,AF AMER,Political Economy of Race,M200B,{5866360}
African American Studies,AF AMER,"Race, Inequality, and Public Policy",M120,{5864219}
African American Studies,AF AMER,"Research in Black Life, Institutions, and Culture",184A,{1006}
African American Studies,AF AMER,Social Organization of Black Communities,M5,{5865360}
African American Studies,AF AMER,Social Politics of Recent African American Music and Popular Culture,200H,{4073}
African American Studies,AF AMER,Special Courses in African American Studies: Africana Art,188A,{2529}
African American Studies,AF AMER,Special Courses in African American Studies: Black and Migration Literature,188A,{2208}
African American Studies,AF AMER,Special Courses in African American Studies: Black Deejay Culture and Music Migration,188A,"{5864666,5864764}"
African American Studies,AF AMER,Special Courses in African American Studies: Lecture 3  ,188A,"{5865711,1131}"
African American Studies,AF AMER,Special Courses in African American Studies: Lecture 4  ,188A,{5862444}
African American Studies,AF AMER,Special Courses in African American Studies: Lecture 5  ,188A,{5863432}
African American Studies,AF AMER,Special Courses in African American Studies: Race and U.S. Military Intervention in Africa,188A,{33}
African American Studies,AF AMER,"Special Courses in African American Studies: Race, Science, and Western Society",188A,{521}
African American Studies,AF AMER,"Special Courses in African American Studies: Remembering Slavery, Remaking Race",188A,{3135}
African American Studies,AF AMER,Special Courses in African American Studies: Reproducing While Black,188A,{5860625}
African American Studies,AF AMER,"Special Courses in African American Studies: Sunken Place: Racism, Survival, and Black Horror Aesthetic",188A,{2527}
African American Studies,AF AMER,Special Topics in Afro-American Studies: African Americans and Latino Relations in U.S.,C291,{5867026}
African American Studies,AF AMER,Special Topics in Afro-American Studies: Blackness and Borderscapes,241,{2942}
African American Studies,AF AMER,Special Topics in Afro-American Studies: Blackness and Indigeneity in Europe,C291,{5863461}
African American Studies,AF AMER,Special Topics in Afro-American Studies: Black Studies Movement,C291,{5863482}
African American Studies,AF AMER,Special Topics in Afro-American Studies: Lecture 2  ,241,{785}
African American Studies,AF AMER,Special Topics in Afro-American Studies: Seminar 2  ,C291,{4963}
African American Studies,AF AMER,Special Topics in Afro-American Studies: Seminar 3  ,C291,{3560}
African American Studies,AF AMER,Student-Initiated Retention and Outreach Issues in Higher Education,M118,{2701}
African American Studies,AF AMER,Survey of Afro-American Research: Seminar 1  ,270A,"{2996,5866829}"
African American Studies,AF AMER,Topics in African American Literature and Culture: Lecture 1  ,M104E,{3019}
African American Studies,AF AMER,Topics in African American Literature and Culture: Lecture 2  ,M104E,{1823811}
African American Studies,AF AMER,Topics in African American Literature: Seminar 1  ,M179A,{2654}
African American Studies,AF AMER,Trends in Black Intellectual Thought,6,{2232}
African American Studies,AF AMER,UCLA Centennial Initiative: Arthur Ashe and Second Half of 20th Century,19,{5864060}
African American Studies,AF AMER,"UCLA Centennial Initiative: Social Justice, Student Activism, and Academic Advancement Program",19,{5866343}
African American Studies,AF AMER,Variable Topics Research Seminars: Afro-American Studies: African Americans and Latino Relations in U.S.,C191,{5864242}
African American Studies,AF AMER,Variable Topics Research Seminars: Afro-American Studies: Afro-Latin America,C191,{5864811}
African American Studies,AF AMER,Variable Topics Research Seminars: Afro-American Studies: Blackness and Indigeneity in Europe,C191,{5863045}
African American Studies,AF AMER,Variable Topics Research Seminars: Afro-American Studies: By Any Means Necessary: Politics and Poetry of Malcolm X,C191,{2997}
African American Studies,AF AMER,Variable Topics Research Seminars: Afro-American Studies: Seminar 1  ,C191,{5860696}
African American Studies,AF AMER,Variable Topics Research Seminars: Afro-American Studies: Seminar 2  ,C191,{2594}
African Studies,AFRC ST,Africa and Disciplines,201A,{5859872}
African Studies,AFRC ST,Africanist Working Group,296,{3341835}
American Indian Studies,AM IND,Economic Principles and Economic Development in Indigenous Communities,M200D,{2307}
American Indian Studies,AM IND,Federal Indian Law I,M265A,{265}
American Indian Studies,AM IND,Honors Contracts,89HC,{5859850}
American Indian Studies,AM IND,Introduction to American Indian Studies,M10,"{2198,5859840}"
American Indian Studies,AM IND,Introduction to Interdisciplinary Methods in American Indian and Indigenous Studies: Lecture 1  ,201,"{6,146}"
American Indian Studies,AM IND,Introduction to Interdisciplinary Methods in American Indian and Indigenous Studies: Lecture 2  ,201,{1552}
American Indian Studies,AM IND,Key Theories and Concepts in American Indian Studies,202,{5859847}
American Indian Studies,AM IND,Leadership and Student-Initiated Retention,M18,{2254}
American Indian Studies,AM IND,Native American Languages and Discourses of Indigeneity,M208,{5146}
American Indian Studies,AM IND,Special Topics in American Indian and Gender Studies: Indigenous Others and Gaze,M187A,{539}
American Indian Studies,AM IND,Student-Initiated Retention and Outreach Issues in Higher Education,M118,{2685}
American Indian Studies,AM IND,Tribal Legal Development Clinic,238A,"{5859851,4057119}"
American Indian Studies,AM IND,UCLA Centennial Initiative: American Indian Studies for Everyone,19,{644}
American Indian Studies,AM IND,Working in Tribal Communities: Preparing for Fieldwork,C121,{4209}
American Indian Studies,AM IND,Working in Tribal Communities: Preparing for Fieldwork,C221,{3107}
American Sign Language,ASL,Elementary American Sign Language,1,"{5863629,5863658}"
American Sign Language,ASL,Elementary American Sign Language,2,{3011}
American Sign Language,ASL,Enforcing Normalcy: Deaf and Disability Studies,M115,{3271}
American Sign Language,ASL,Intermediate American Sign Language,4,{5867603}
American Sign Language,ASL,Intermediate American Sign Language,5,{967}
Ancient Near East,AN N EA,Achaemenid Civilization and Empire of Alexander,M60,{5861465}
Ancient Near East,AN N EA,"Archaeology, Identity, and Bible",162,{5153}
Ancient Near East,AN N EA,Conceptions of Race in Ancient Egypt,175,{1656}
Ancient Near East,AN N EA,Coptic,C223A,{5860691}
Ancient Near East,AN N EA,Coptic,C223B,{61}
Ancient Near East,AN N EA,Elementary Ancient Egyptian,120C,{5860544}
Ancient Near East,AN N EA,First Civilizations,M50A,{5861128}
Ancient Near East,AN N EA,History of Ancient Mesopotamia and Syria,M104A,{366}
Ancient Near East,AN N EA,Iranian Civilization: History of Arsacid (Parthian) Empire,M110B,{2084}
Ancient Near East,AN N EA,Jerusalem: Holy City,10W,{5861437}
Ancient Near East,AN N EA,Jerusalem: Holy City,12W,{1144}
Ancient Near East,AN N EA,"Medicine, Magic, and Science in Ancient Times",14W,{297}
Ancient Near East,AN N EA,"Origins of Judaism, Christianity, and Islam",M50B,{2096}
Ancient Near East,AN N EA,Practical Field Archaeology,261,"{5861442,40,5861471}"
Ancient Near East,AN N EA,Seminar: Ancient Egypt: Seminar 1  ,220,"{5860465,1371}"
Ancient Near East,AN N EA,Seminar: Ancient Egypt: Seminar 2  ,220,{11}
Ancient Near East,AN N EA,Seminar: Ancient Near Eastern Archaeology,260,{5860782}
Ancient Near East,AN N EA,Seminar: Ancient Syria/Palestine,230,"{5861275,318}"
Ancient Near East,AN N EA,Variable Topics in Ancient Near East: Lecture 1  ,C277,{5861459}
Ancient Near East,AN N EA,Variable Topics in Ancient Near East: Sacred Kingship,C177,{5861273}
Ancient Near East,AN N EA,Women and Power in Ancient World,15,{537}
Ancient Near East,AN N EA,Women and Power in Ancient World,15W,"{5859891,5859871}"
Anthropology,ANTHRO,Amazon in Anthropocene,M128T,{5866395}
Anthropology,ANTHRO,Animals in Translation: Evolutionary Approach to Animal Thinking and Autism,19,"{5864389,5864365,5864388}"
Anthropology,ANTHRO,Anthropology Graduate Proseminar,200,{5866717}
Anthropology,ANTHRO,Archaeological Landscapes of China,M116R,{2266}
Anthropology,ANTHRO,Archaeology: Introduction,2,{5865770}
Anthropology,ANTHRO,Beginning Seminar,191HA,{1782}
Anthropology,ANTHRO,"Behavior, Evolution, and Culture",221,"{5866381,4776}"
Anthropology,ANTHRO,California Archaeology,113Q,{2265}
Anthropology,ANTHRO,Careers in Anthropology,141,"{5860606,4400}"
Anthropology,ANTHRO,"Central Asian Studies: Discipline, Methods, Debates",M247Q,{2669866}
Anthropology,ANTHRO,Community and Corporate Internships in Anthropology,195CE,"{109,2117}"
Anthropology,ANTHRO,Core Seminar: Biological Anthropology,202B,{3734}
Anthropology,ANTHRO,Core Seminar: Biological Anthropology Colloquium,202A,{5860760}
Anthropology,ANTHRO,Core Seminar: Linguistic Anthropology,204A,{5866361}
Anthropology,ANTHRO,Core Seminar: Sociocultural Anthropology--Historical and Philosophical Foundations of Anthropology,203A,{5859546}
Anthropology,ANTHRO,"Core Seminar: Sociocultural Anthropology--Sociocultural Systems and Ethnography, Anthropology at Mid-Century",203B,{3851}
Anthropology,ANTHRO,Culture and Communication,4,"{5865731,2688}"
Anthropology,ANTHRO,Culture and Society,3,"{5860713,1429}"
Anthropology,ANTHRO,Culture Area of Maghrib (North Africa),M166Q,{5864299}
Anthropology,ANTHRO,"Culture, Power, Social Change",241,"{5062,5866339}"
Anthropology,ANTHRO,Data Analysis,191HC,{5858668}
Anthropology,ANTHRO,Discourse Laboratory,254,"{5866904,5074}"
Anthropology,ANTHRO,Ethnography of Everyday Speech,151,{5858239}
Anthropology,ANTHRO,Evolution of Human Sexual Behavior,124S,{5860633}
Anthropology,ANTHRO,Evolution of Personality,124T,{5864070}
Anthropology,ANTHRO,Experimental Biological Anthropology,223,"{5864096,4294}"
Anthropology,ANTHRO,Field Methods in Cultural Anthropology,138P,{5858662}
Anthropology,ANTHRO,Gender and Language in Society,154Q,{3372}
Anthropology,ANTHRO,Graduate Core Seminar: Archaeology,M201A,{5867034}
Anthropology,ANTHRO,Graduate Core Seminar: Archaeology,M201B,{3792}
Anthropology,ANTHRO,Health and Culture in Americas,M233R,{4183}
Anthropology,ANTHRO,History of Anthropology,100,{2314}
Anthropology,ANTHRO,Honors Contracts,189HC,"{6358110,5866401,3236452,3995608,5866439,6225987,7341217,4005997}"
Anthropology,ANTHRO,Honors Contracts,89HC,{5858189}
Anthropology,ANTHRO,Hormones and Behavior in Humans and Other Animals,M128R,{1323}
Anthropology,ANTHRO,Human Evolution,1,{57}
Anthropology,ANTHRO,Ideology and Social Change in Contemporary China,163P,{2988}
Anthropology,ANTHRO,Individual Studies for USIE Facilitators,188SA,{5864281}
Anthropology,ANTHRO,Individual Studies for USIE Facilitators,188SB,{4012}
Anthropology,ANTHRO,Individual Studies in Anthropology,197,"{5867710,78349,5867681,3815768}"
Anthropology,ANTHRO,Introduction to Psychological Anthropology: Current Topics and Research,136B,{935}
Anthropology,ANTHRO,Language and Identity,153,{5866371}
Anthropology,ANTHRO,Language and Social Organization through Life Cycle,152Q,{4810}
Anthropology,ANTHRO,Language Ideologies: Political Economy of Language Beliefs and Practices,253,{5858280}
Anthropology,ANTHRO,Making and Studying Modern Middle East,M67W,{5865062}
Anthropology,ANTHRO,"Marriage, Family, and Kinship",M145P,{5170}
Anthropology,ANTHRO,"Mind, Medicine, and Culture",234,"{445,5860756}"
Anthropology,ANTHRO,Modernization and Taiwan Indigenous Societies,247R,{5442}
Anthropology,ANTHRO,Multilingualism: Communities and Histories in Contact,154P,{5865771}
Anthropology,ANTHRO,Native American Languages and Discourses of Indigeneity,M255,{3967}
Anthropology,ANTHRO,Native American Languages and Their Speakers,155,{160}
Anthropology,ANTHRO,Paleopathology,126P,{2661}
Anthropology,ANTHRO,Past People and Their Lessons for Our Own Future,M148,{4515}
Anthropology,ANTHRO,Philippine Cuisines and Cultural Identities,19,{3339}
Anthropology,ANTHRO,Principles of Archaeology,110,{5858636}
Anthropology,ANTHRO,"Psychological Anthropology: Constituting, Cognizing, and Communicating: Social Relationships, Innate Expectations, and Cultural Realizations",M237,{5865418}
Anthropology,ANTHRO,Qualitative Research Methodology,M284A,{3451}
Anthropology,ANTHRO,Research Group Seminars: Anthropology,194,"{4812,5865364,5865401,4349,3810899}"
Anthropology,ANTHRO,Selected Laboratory Topics in Archaeology: Basic Mapping and Field Archaeology,C117,{3138}
Anthropology,ANTHRO,Selected Laboratory Topics in Archaeology: Basic Mapping and Field Archaeology,CM217,{4457}
Anthropology,ANTHRO,Selected Laboratory Topics in Archaeology: Lecture 1  ,C117,{5864267}
Anthropology,ANTHRO,Selected Laboratory Topics in Archaeology: Lecture 1  ,CM217,{5858643}
Anthropology,ANTHRO,Selected Laboratory Topics in Archaeology: Paleoethnobotany,C117,{3066}
Anthropology,ANTHRO,Selected Laboratory Topics in Archaeology: Paleoethnobotany,CM217,{3740}
Anthropology,ANTHRO,Selected Topics in Anthropology: Professional Development,299,{4683}
Anthropology,ANTHRO,Selected Topics in Anthropology: Quantitative Data Analysis in Anthropology,299,{4471}
Anthropology,ANTHRO,Selected Topics in Archaeology: Archaeology of Extinction,119,{634}
Anthropology,ANTHRO,Selected Topics in Archaeology: Archaeology of Trade and Interactions,119,{5865381}
Anthropology,ANTHRO,Selected Topics in Archaeology: Lecture 1  ,119,{5858454}
Anthropology,ANTHRO,Selected Topics in Archaeology of Southeast Asia,116S,{5866121}
Anthropology,ANTHRO,Selected Topics in Biological Anthropology: Evolutionary Medicine,129,{4679}
Anthropology,ANTHRO,"Selected Topics in Biological Anthropology: Genes, Disease, and Culture",129,{4364}
Anthropology,ANTHRO,Selected Topics in Biological Anthropology: Molecular Anthropology,129,{5867019}
Anthropology,ANTHRO,"Selected Topics in Biological Anthropology: Mother Nature, Father Time: Evolutionary Perspectives on Parenting",129,{4257}
Anthropology,ANTHRO,Selected Topics in Cultural Anthropology: Anthropology of Los Angeles,139,{879}
Anthropology,ANTHRO,Selected Topics in Cultural Anthropology: Field Methods,139,{2304}
Anthropology,ANTHRO,Selected Topics in Cultural Anthropology: Indigenous Women and Violence,139,{5865862}
Anthropology,ANTHRO,Selected Topics in Cultural Anthropology: Medical Anthropology,139,{5866370}
Anthropology,ANTHRO,"Selected Topics in Cultural Anthropology: Race, Gender, and Comedy",139,{5858432}
Anthropology,ANTHRO,Selected Topics in Field Ethnography: Photoethnographic Methods,239,{5866707}
Anthropology,ANTHRO,Selected Topics in Linguistic Anthropology: Language of Secrecy and Exposure,159,{5859566}
Anthropology,ANTHRO,Selected Topics in Linguistic Anthropology: Seminar 1  ,259,{5862499}
Anthropology,ANTHRO,Selected Topics in Regional Cultures: Ecology of Crime,169,{5858217}
Anthropology,ANTHRO,Selected Topics in Social Anthropology: Critical Phenomenology,249,{5222}
Anthropology,ANTHRO,Selected Topics in Social Anthropology: Critical Study of Migration,249,{5862518}
Anthropology,ANTHRO,Selected Topics in Social Anthropology: Lecture 1  ,149,{5858415}
Anthropology,ANTHRO,Selected Topics in Social Anthropology: Social Debates and Popular Culture in Israel,149,{3747}
Anthropology,ANTHRO,Study of Culture,130,{5865859}
Anthropology,ANTHRO,Study of Social Systems,140,{4123}
Anthropology,ANTHRO,Teaching Anthropology,495,{5858459}
Anthropology,ANTHRO,Theory in Anthropological Archaeology,111,{4944}
Anthropology,ANTHRO,Topics in Asian Archaeology: Material Culture and Society of Iron Age Japan,M216,{3699}
Anthropology,ANTHRO,UCLA Centennial Initiative: Celebration of American Indian Studies,19,"{5858353,5858223}"
Anthropology,ANTHRO,UCLA Centennial Initiative: Everyday Lives of Middle-Class Families in Los Angeles,19,{293}
Anthropology,ANTHRO,Variable Topics Research Seminars: Anthropology: Japan: Challenging Myth of Homogeneity,191,{2499}
Anthropology,ANTHRO,Variable Topics Research Seminars: Anthropology: Research on Emotion of Being Moved or Touched,191,{3795}
Anthropology,ANTHRO,Visual Anthropology: Documentary Photography,135,{4786}
Anthropology,ANTHRO,Why am I Crying over These Kittens?,19,{5860654}
Anthropology,ANTHRO,Writing for Anthropology,191HD,{2448}
Applied Linguistics,APPLING,Introduction to Language Learning and Language Teaching,101W,{2175}
Applied Linguistics,APPLING,Language and Gender: Introduction to Gender and Stereotypes,40W,{2691}
Arabic,ARABIC,Advanced Arabic,103A,{5862074}
Arabic,ARABIC,Advanced Arabic,103B,{1397}
Arabic,ARABIC,Arabic Language Pedagogy Course,496,{5862122}
Arabic,ARABIC,Culture Area of Maghrib (North Africa),M171,{5864064}
Arabic,ARABIC,Elementary Standard Arabic,1A,"{5863468,5863398,5863426,5863375}"
Arabic,ARABIC,Elementary Standard Arabic,1B,"{124,2790,1578}"
Arabic,ARABIC,Honors Contracts,189HC,{4057045}
Arabic,ARABIC,Intermediate Standard Arabic,102A,"{5863030,5863054}"
Arabic,ARABIC,Intermediate Standard Arabic,102B,"{1576,1844}"
Arabic,ARABIC,Readings in Modern Standard Arabic,140,{5862057}
Arabic,ARABIC,Seminar: Premodern Arabic Literature,250,"{735,5860740}"
Arabic,ARABIC,Studies in Arabic Dialectology,115,{5863098}
Arabic,ARABIC,Thousand and One Nights/Alf Layla Wa-Layla,M110,{1736}
Arabic,ARABIC,Translating Arabic,181,"{2736,5864066}"
Arabic,ARABIC,Variable Topics in Arabic: Maltese,177,{671}
Archaeology,ARCHEOL,Graduate Core Seminar: Archaeology,M201A,{5861082}
Archaeology,ARCHEOL,Graduate Core Seminar: Archaeology,M201B,{1633}
Archaeology,ARCHEOL,Selected Laboratory Topics in Archaeology: Basic Mapping and Field Archaeology,M205A,{734}
Archaeology,ARCHEOL,Selected Laboratory Topics in Archaeology: Lecture 1  ,M205A,{5859762}
Archaeology,ARCHEOL,Selected Laboratory Topics in Archaeology: Paleoethnobotany,M205A,{1305}
Architecture and Urban Design,ARCH&UD,Advanced Topics Studio,401,"{5864237,3204,5864406,5864185,2761,195,2920,5864428,5864218,2971,5864339,5864379,1156,1157,1934,5864296}"
Architecture and Urban Design,ARCH&UD,Architectural Practice,461,{5858357}
Architecture and Urban Design,ARCH&UD,Building Design Studio,412,"{1434,1266,1545,2106,1608}"
Architecture and Urban Design,ARCH&UD,Building Design with Landscape Studio,413,"{5858311,5858338,5858322,5858363}"
Architecture and Urban Design,ARCH&UD,Comprehensive Studio,415,"{712,761,993,713}"
Architecture and Urban Design,ARCH&UD,Domestic Architecture: Critical History,132,{2630}
Architecture and Urban Design,ARCH&UD,Environmental Control Systems,441,{248}
Architecture and Urban Design,ARCH&UD,History of Architecture and Urban Design: Prehistory to Mannerism,10A,{2750}
Architecture and Urban Design,ARCH&UD,Individual Studies for USIE Facilitators,188SA,{5863315}
Architecture and Urban Design,ARCH&UD,Individual Studies for USIE Facilitators,188SB,{2745}
Architecture and Urban Design,ARCH&UD,Introduction to Architectural Studies,30,{5868401}
Architecture and Urban Design,ARCH&UD,Introduction to Building Construction,436,{2776}
Architecture and Urban Design,ARCH&UD,Introduction to Computers,220,{5860992}
Architecture and Urban Design,ARCH&UD,Introduction to Sustainable Architecture and Community Planning,CM153,{4898}
Architecture and Urban Design,ARCH&UD,Introduction to Sustainable Architecture and Community Planning,CM247A,{2196}
Architecture and Urban Design,ARCH&UD,Introductory Design Studio,411,"{5866923,5866967,5867029,5866846,5866887}"
Architecture and Urban Design,ARCH&UD,Issues in Contemporary Design,131,{5863693}
Architecture and Urban Design,ARCH&UD,Real Estate Development and Finance,M272,{1142}
Architecture and Urban Design,ARCH&UD,Research Studio,403A,"{5858494,5858422,5858388,5858456,5858468,5858446,5858347,5858371}"
Architecture and Urban Design,ARCH&UD,Research Studio,403B,"{2063,2064,2065,3331,1564,3332,2066,164}"
Architecture and Urban Design,ARCH&UD,Special Projects in Architecture,496,"{1226,3316,1109,5865075,892,2550,1822,5864872,317,5864253,987,2549,5864225,989,5865520,1211,256,5865557,1944,5864541,5865180,1111,1060,3152,1667,257,5864443,5103,5865435,5865053,5865008,5864990,5865306,5864287,5865377,5864758,94,5864479,2551,3097,5865149,1840,839,2712,4503,2335,5864726,5865116,5864417,5864618,5864651,5864591,5865225,5865334,5865468,832,3321,5865245,3638,5864804,3035,5864567,5865646,5864915,5864387,772,5865608,5864204,2937,1447,1383}"
Architecture and Urban Design,ARCH&UD,Special Topics in Architecture and Urban Design,289,"{5861278,3681,5248,5861252,5861216,5861304,4594,4065,4937,5861362,5861078,5861149,4328,5861115,3636,5249,5861010,3848,3846,4002,5861232,5861376}"
Architecture and Urban Design,ARCH&UD,Special Topics in Critical Studies in Architectural Culture,290,"{3183,5866284}"
Architecture and Urban Design,ARCH&UD,Structures I,431,{5868406}
Architecture and Urban Design,ARCH&UD,Structures II,432,{4420}
Architecture and Urban Design,ARCH&UD,Studio I,121,{4538}
Architecture and Urban Design,ARCH&UD,Studio II,122,{5858365}
Architecture and Urban Design,ARCH&UD,Technology II: Building Materials and Methods,142,{871}
Architecture and Urban Design,ARCH&UD,Technology I: Projections,141,{5859472}
Architecture and Urban Design,ARCH&UD,Theories of Architecture,M201,{5863739}
Architecture and Urban Design,ARCH&UD,Theory of Architectural Programming,291,{5410}
Armenian,ARMENIA,"Armenian Poetry, 1880 to 1930",170,{5860646}
Armenian,ARMENIA,Armenian Society and Culture,106C,{3013}
Armenian,ARMENIA,Elementary Classical Armenian,230A,{5860660}
Armenian,ARMENIA,Elementary Classical Armenian,230B,{1486}
Armenian,ARMENIA,Elementary Modern Eastern Armenian,104A,{5860558}
Armenian,ARMENIA,Elementary Modern Eastern Armenian,104B,{1599}
Armenian,ARMENIA,Elementary Modern Western Armenian,101A,{5858408}
Armenian,ARMENIA,Elementary Modern Western Armenian,101B,{332}
Armenian,ARMENIA,Intermediate Modern Eastern Armenian,105A,{5860516}
Armenian,ARMENIA,Intermediate Modern Eastern Armenian,105B,{1161}
Armenian,ARMENIA,Intermediate Modern Western Armenian,102A,{5860772}
Armenian,ARMENIA,Intermediate Modern Western Armenian,102B,{2219}
Armenian,ARMENIA,Variable Topics in Armenian Studies: Language in Action,171,{5860662}
Armenian,ARMENIA,Variable Topics in Armenian Studies: Lecture 1  ,171,{2981}
Art,ART,Advanced Ceramics,148,"{5866900,2046}"
Art,ART,Advanced Drawing,130,"{1660,5866867}"
Art,ART,Advanced New Genres: Studio 1  ,137,"{5091,5861963}"
Art,ART,Advanced Painting,133,"{3150,1943,5866359,5866385}"
Art,ART,Advanced Photography,147,"{4851,5860686,5860663}"
Art,ART,Advanced Printmaking,140,"{5868157,705}"
Art,ART,Advanced Sculpture,145,"{654,5861486}"
Art,ART,Ceramics,11E,"{2634,5861476}"
Art,ART,Chicana Art and Artists,M184,{5038}
Art,ART,Community Internships in Art,195,"{8151688,5864681,2125272,5864718,3232221,5864748}"
Art,ART,Drawing,1A,"{5860641,812}"
Art,ART,Global Modernism,31B,{235}
Art,ART,Graduate Ceramics,277,"{2934,5866122}"
Art,ART,Graduate Group Critique,276,"{5213,5863043,5863069}"
Art,ART,Graduate New Genres,275,"{5866963,4119,5417,5866905}"
Art,ART,Graduate Painting,271,"{5863134,2222,3038,3036,5863060,3096,5863167,5863093}"
Art,ART,Graduate Photography,274,"{5864749,5476,5864684,5477}"
Art,ART,Graduate Sculpture,273,"{5057,5862166,5862104,4120}"
Art,ART,Honors Research in Art,198,"{2297739,1824025}"
