subject_area,subj_code,title,number,section_ids
History,HIST,Advanced Honors Seminars: Advanced Honors Seminar for History 139B,189,{2257508}
History,HIST,"American Economic History, 1790 to 1910",141A,{5863657}
History,HIST,"American Economic History, 1910 to Present",141B,{3239}
History,HIST,American Working Class Movements,146B,{182}
History,HIST,Ancient Jewish History,M182A,{5866986}
History,HIST,"Armenian History: Armenia from Cilician Kingdom through Periods of Foreign Domination and National Stirrings, 11th to 19th Centuries",107B,{3616}
History,HIST,"Armenian History: Armenia in Ancient and Medieval Times, 2nd Millennium BC to AD 11th Century",107A,{397}
History,HIST,Asians in American History,152,{2739}
History,HIST,Byzantine History,116A,{1455}
History,HIST,"CAPPP Washington, DC, Internships",M195DC,"{5860961,2669838}"
History,HIST,"CAPPP Washington, DC, Research Seminars",M191DC,"{4641,5866292}"
History,HIST,"CAPPP Washington, DC, Research Seminars",M194DC,"{744,5866070}"
History,HIST,Capstone Seminar: History--Ancient History: Roman Law,191A,{1026}
History,HIST,Capstone Seminar: History--Europe: Imperial Cities,191C,{1360}
History,HIST,Capstone Seminar: History--Europe: Saint Making in Early Modern Europe,191C,{5865183}
History,HIST,Capstone Seminar: History--Europe: Seminar 4  ,191C,{5866519}
History,HIST,"Capstone Seminar: History--Europe: Work and Play in Early Modern Europe: Inquiry, Interpretation, and Exhibit",191C,{5860445}
History,HIST,"Capstone Seminar: History--Europe: World War II, Vichy France, and German Occupation",191C,{5865071}
History,HIST,"Capstone Seminar: History--Jewish History: History, Television, and Truth: Israeli-Palestinian Conflict on Small Screen",191L,{223}
History,HIST,"Central Asian Studies: Discipline, Methods, Debates",M287,{2669876}
History,HIST,Colloquium: African History,275A,{5865097}
History,HIST,Colloquium: African History,275B,{510}
History,HIST,Colonial Latin America,8A,{5858518}
History,HIST,Community and Corporate Internships in History,195CE,"{5866561,147}"
History,HIST,Community or Corporate Internships in History,195,"{5865773,2530966}"
History,HIST,"Contemporary World History, 1760 to Present",22,{5868149}
History,HIST,"Cultural and Intellectual History of Modern Europe, 15th Century",122A,{5866465}
History,HIST,"Cultural and Intellectual History of Modern Europe, 16th Century",122B,{3872}
History,HIST,"Cultural and Intellectual History of Modern Europe, 19th Century",M122E,{3782}
History,HIST,Culture and Power in Late Imperial China,170A,{5868435}
History,HIST,Culture Area of Maghrib (North Africa),M108C,{5867139}
History,HIST,"Departmental Seminar: Approaches, Methods, Debates, Practices",204A,{5860959}
History,HIST,"Europe in Age of Revolution, circa 1775 to 1815",126,{5866310}
History,HIST,From Colonialism to Call for Climate Justice: Environmental Histories of Modern South Asia,98T,{681}
History,HIST,"Global Feminism, 1850 to Present",M186B,{5061}
History,HIST,History of Africa to 1800,M10A,{1463}
History,HIST,History of Ancient Greece: Classical Period,113B,{1339}
History,HIST,History of Ancient Greece: Rise of Greek City-State,113A,{5865144}
History,HIST,History of Ancient Mesopotamia and Syria,M104A,{2847}
History,HIST,History of Chicano Peoples,M151A,{5859450}
History,HIST,"History of China, circa 1000 to 2000",11B,{5860859}
History,HIST,History of China: To 1000,11A,{4497}
History,HIST,History of Early Christians,M185F,{1231}
History,HIST,History of European Political Thought,130,{527}
History,HIST,"History of France: France, 1715 to 1871",124B,{5860294}
History,HIST,"History of France: Making of Modern France, 1871 to Present",124C,{915}
History,HIST,History of Medicine: Foundations of Modern Medicine,179B,{4951}
History,HIST,"History of Modern Europe: Bourgeois Century, 1815 to 1914",121D,{5867192}
History,HIST,"History of Modern Europe: Era of Total War, 1914 to 1945",121E,{2197}
History,HIST,"History of Modern Europe: World War II and Its Aftermath, 1939 to Present",121F,{5867196}
History,HIST,History of Modern Medicine,3D,{520}
History,HIST,History of Rome to Death of Caesar,114A,{5866892}
History,HIST,History of Russia: Imperial Russia from Peter the Great to Nicholas II,127B,{1702}
History,HIST,"History of Russia, Origins to Rise of Muscovy",M127A,{5867956}
History,HIST,History of Science: 20th Century,3C,{739}
History,HIST,History of Science: Renaissance to 1800,3A,{5866884}
History,HIST,History of Southeast Asia: Southeast Asia since 1815,176B,{5165}
History,HIST,History of Southern Africa since 1870,168B,{1978}
History,HIST,History of the U.S. and Its Colonial Origins: 19th Century,13B,{1801}
History,HIST,History of the U.S. and Its Colonial Origins: Colonial Origins and First Nation Building Acts,13A,{5860893}
History,HIST,"History of Women in U.S., 1860 to 1980",M147D,{5866881}
History,HIST,"History of Women, Men, Sexuality",213A,{5866089}
History,HIST,"History of Women, Men, Sexuality",213B,{3438}
History,HIST,Holocaust: History and Memory,5,{2301}
History,HIST,Honors Contracts,189HC,"{5859534,5859455,6636413,5859501,6410335,3230574,3786050,2941241,2669905,5859480}"
History,HIST,Honors Contracts,89HC,"{5863293,3813161}"
History,HIST,Honors Research in History,198A,"{3236480,5866641,3643418,5866582,5866504}"
History,HIST,Honors Research in History,198B,"{5863862,5864025,5863785,5863747,5863723,5863766,5864148,5863903,5863998,3345346,5863983,3513709,5864079,5863684,5863949,5864098}"
History,HIST,Honors Research in History,198C,"{2280313,3645289,3167,1967712,2246453,2280360,2664704,3166,2179360,3387467,447,3536219,2929186,3101104}"
History,HIST,Individual Studies for USIE Facilitators,188SA,{5860483}
History,HIST,Individual Studies for USIE Facilitators,188SB,{3292}
History,HIST,"Indo-Islamic Interactions, 1750 to 1950",M174E,{5866570}
History,HIST,Inequality: History of Mass Imprisonment,12A,{5250}
History,HIST,Interdisciplinary American Studies,M299,{278}
History,HIST,Introduction to Afro-American History,M150B,{2849}
History,HIST,Introduction to Asian Civilizations: History of Japan,9C,{5868150}
History,HIST,Introduction to Asian Civilizations: History of Middle East,9D,{5866467}
History,HIST,Introduction to Historical Practice: From Colonialism to Call for Climate Justice: Environmental History of Modern South Asia,96W,{5859521}
History,HIST,"Introduction to Historical Practice: Immigration, Migration, and Displacement in Middle East and Balkans",96W,"{753,5866424}"
History,HIST,Introduction to Historical Practice: Inquisition: Power and Faith in Middle Ages,96W,"{2371,5865721}"
History,HIST,Introduction to Historical Practice: Outsiders and Otherness in Late Medieval Europe,96W,{5868322}
History,HIST,Introduction to Historical Practice: Race and Jews in U.S.,96W,"{5866503,2107}"
History,HIST,Introduction to Historical Practice: Rich and Poor in Middle Ages,96W,{2878}
History,HIST,Introduction to Historical Practice: Tech Culture in California,96W,{5863869}
History,HIST,Introduction to Historical Practice: Urban Historical Fiction: Los Angeles,96W,{960}
History,HIST,Introduction to Historical Practice: Variable Topics in African History: Timbuktu Chronicles and other African Sources,97J,{340}
History,HIST,"Introduction to Historical Practice: Variable Topics in East Asian History: Shanghai's New Culture, 1895 to 1937",97G,{5860854}
History,HIST,Introduction to Historical Practice: Variable Topics in European History: Free Speech and Tolerance: History and Issues,97C,"{5860395,5860329}"
History,HIST,Introduction to Historical Practice: Variable Topics in European History: Philosophy and Utopia in Early Modern Europe,97C,{3820}
History,HIST,Introduction to Historical Practice: Variable Topics in European History: Seminar 1  ,97C,{5858289}
History,HIST,Introduction to Historical Practice: Variable Topics in U.S. History: Americans and Empires,97D,{4304}
History,HIST,"Introduction to Historical Practice: Variable Topics in U.S. History: Freedom, Power, and Protest in Modern America",97D,{2320}
History,HIST,Introduction to Historical Practice: Variable Topics in U.S. History: Seminar 1  ,97D,{5866242}
History,HIST,Introduction to Historical Practice: Variable Topics in U.S. History: Seminar 2  ,97D,{5866178}
History,HIST,Introduction to History and Culture of Iranian Jews,M178,{4392}
History,HIST,Introduction to History of Religions,M4,{5866335}
History,HIST,Introduction to Public/Applied History,148,"{5868339,2792}"
History,HIST,Introduction to U.S. History: 1790 to 1900,246B,{2841}
History,HIST,Introduction to U.S. History: Colonial Period,246A,{5865304}
History,HIST,"Introduction to Western Civilization: Ancient Civilizations, Prehistory to circa AD 843",1A,"{5866445,1454}"
History,HIST,Introduction to Western Civilization: Circa 1715 to Present,1C,{5866449}
History,HIST,Introduction to Western Civilization: Circa 843 to circa 1715,1B,{4429}
History,HIST,Iranian Civilization: History of Arsacid (Parthian) Empire,M110B,{4875}
History,HIST,"Medieval Europe, 400 to 1000",119A,{2359}
History,HIST,Modern Brazil,162A,{1531}
History,HIST,Modern Jewish History,M182C,{5864700}
History,HIST,Modern Latin America,8B,{2855}
History,HIST,Nationalism and Modernization in 19th-Century Germany,125B,{5866493}
History,HIST,New Middle East: Crisis and Conflict,19,"{5858548,5858558}"
History,HIST,"North American Indian History, Precontact to 1830",149A,{5858565}
History,HIST,"Paleography of Latin and Vernacular Manuscripts, 900 to 1500",M218,{5866506}
History,HIST,Philippine History,176C,{5866539}
History,HIST,Political Economy of Race,M256C,{5859409}
History,HIST,Postwar Japanese History through Film,173D,{5004}
History,HIST,Selected Topics in Chinese History from 1500: Chinese Overseas: from Early Modern Traders to Global Citizens,170B,{3242}
History,HIST,Selected Topics in Chinese History from 1500: Lecture 1  ,170B,{5866514}
History,HIST,Social World of Jane Austen: Pride and Prejudice,19,{1799}
History,HIST,Sophomore Seminars: History: Seminar 1  ,88,{4854}
History,HIST,"Survey of Middle East, 500 to Present: 500 to 1300",105A,{5863863}
History,HIST,Teaching History,495,"{5316,5865941}"
History,HIST,Topics in African History: Africa and Slave Trade,164B,{916}
History,HIST,Topics in African History: Lecture 1  ,165,{5868147}
History,HIST,Topics in European History: Iberian History from Middle Ages to 1700s,132,{5862842}
History,HIST,Topics in Historiography: India: Mughal Empire and Its Neighbors,C187N,{5859574}
History,HIST,"Topics in Historiography: Japan: Empire, Migration, and Race Relations",C187R,{1194}
History,HIST,Topics in Historiography: Japan: Postwar Japan on Film,C200M,{3161}
History,HIST,Topics in Historiography: Theory of History: Seminar 1  ,C187P,{5866476}
History,HIST,Topics in Historiography: World History: Environmental History in Global Perspective,C187O,{3671}
History,HIST,Topics in Historiography: World History: Placing Economic History in Environmental History,C187O,{5467}
History,HIST,Topics in History: China: Gender and Sexuality in Early Modern and Modern China,201L,{5866430}
History,HIST,Topics in History: China: Ming China and Its World,201L,{4234}
History,HIST,Topics in History: Early Modern Europe: Global Habsburgs: New Historiographies of Empire,201D,{5107}
History,HIST,Topics in History: Latin America: Seminar 1  ,201I,"{1838,5866528}"
History,HIST,"Topics in History of Science: History of Life Sciences, Renaissance to 1800",180A,{5866877}
History,HIST,Topics in History of Science: Transportation History: Mobility between Engineering and Policy,180A,{5866536}
History,HIST,Topics in History: Science/Technology: Medicine and Human Sciences Since 1800,201O,{5060}
History,HIST,Topics in History: U.S.: History and Theory of U.S. Imperialism and Anti-Imperialism,C201H,{3691}
History,HIST,Topics in History: U.S.: History of Los Angeles from World War II to Present,C191D,{3939}
History,HIST,Topics in History: U.S.: Los Angeles and Automobile: Technology and Urban Form in 20th Century,C191D,{4300}
History,HIST,Topics in History: U.S.: Los Angeles and Automobile: Technology and Urban Form in 20th Century,C201H,{4945}
History,HIST,Topics in History: U.S.: Seminar 1  ,C191D,{5861030}
History,HIST,Topics in History: World: Genocide in World History: Case Studies and Historical Methods,C201W,{5867132}
History,HIST,Topics in History: World: Religion in Early Modern Europe and European Empires,C191O,{4104}
History,HIST,Topics in Latin American History: Cuban Revolution: History and Revolutionary Culture,161,{1085}
History,HIST,Topics in Middle Eastern History: Early Modern: Lecture 1  ,111B,{5860428}
History,HIST,Topics in Middle Eastern History: Modern: Politics of Minorities and Gender in Middle East,111C,{328}
History,HIST,Topics in U.S. History: Lecture 1  ,156,"{2140,5860427}"
History,HIST,Topics in World History: Lecture 2  ,101,{5866542}
History,HIST,"Topics in World History: Postcolonialism, Migration, and Refugees in Netherlands, 1948-2018",101,{5860477}
History,HIST,Topics in World History: Using UCLA Rare Book Collections in History and Theory,214,{5210}
History,HIST,"UCLA Centennial Initiative: UCLA in Los Angeles - Downtown Architecture, Ethnicity, and Social Change",19,{5863810}
History,HIST,"U.S., 1875 to 1900",139B,{1528}
History,HIST,"U.S., Civil War and Reconstruction",139A,{1703}
History,HIST,Variable Topics Historiography Proseminar: Africa: Debating Africa's Pasts,187J,{3894}
History,HIST,Variable Topics Historiography Proseminar: Africa: Radical History of Africa and African Diaspora,187J,{5867151}
History,HIST,Variable Topics Historiography Proseminar: East Asia: Seminar 1  ,187G,{3809}
History,HIST,"Variable Topics Historiography Proseminar: Europe: History of Religion in Modern Germany, 1740 to 1918",187C,{5163}
History,HIST,Variable Topics Historiography Proseminar: Latin America: Caribbean History and Culture,187E,{4462}
History,HIST,"Variable Topics Historiography Proseminar: Medieval: Holy Wars, Medieval and Modern",187B,{5865729}
History,HIST,Variable Topics Historiography Proseminar: Science/Technology: Seminar 1  ,187I,{3631}
History,HIST,Variable Topics Historiography Proseminar: Southeast Asia: Seminar 1  ,187M,{5866875}
History,HIST,"Variable Topics Historiography Proseminar: U.S.: Treason, Dissent, and Irregular Resistance in Civil War Era",187D,{3905}
History,HIST,Variable Topics in History of Medicine: Historic Roots of Healing Arts,179A,{5859469}
History,HIST,Variable Topics in History of Medicine: History of Global Health Technologies,179A,{5265}
History,HIST,Variable Topics in Japanese History: Lecture 1  ,171,{5865115}
History,HIST,Vietnam: Past and Present,176E,{5868438}
History,HIST,"Violence, Law, and Belonging in Film",19,{5866563}
History,HIST,What Is History? An Introduction to Historical Thinking and Practice,94,{5868321}
History,HIST,"Women and Gender, Prehistory to 1792",M186A,{5866535}
History,HIST,"World History, circa 600 to 1760",21,{2519}
History,HIST,Writing Workshop for Graduate Students,490,{5858627}
Honors Collegium,HNRS,Art and Trauma,149,{5867155}
Honors Collegium,HNRS,Asceticism,160,{4546}
Honors Collegium,HNRS,Comedy in Literature,153,{5868299}
Honors Collegium,HNRS,Comparative Genocide,2,{1163}
Honors Collegium,HNRS,Cossacks and Narratives about Them,80,{3324}
Honors Collegium,HNRS,Creating Your Roadmap,50,"{3825,4833}"
Honors Collegium,HNRS,Critical Vision: History of Art as Social and Political Commentary,M179,{1308}
Honors Collegium,HNRS,Culture and History of Utopias,55,{3536}
Honors Collegium,HNRS,"Empire, Globalization, and Multiethnic Storytelling",138,{5865665}
Honors Collegium,HNRS,Foreign Exchange Market and Exchange Rate Forecasting,M109,{3794}
Honors Collegium,HNRS,Future Impact of Nano in New Technologies,174,{3774}
Honors Collegium,HNRS,"Genetic Engineering in Medicine, Agriculture, and Law",70A,{3995}
Honors Collegium,HNRS,Hollywood and Cultural Diversity in America,119,{5866415}
Honors Collegium,HNRS,Imaginary Women,M106,{2576}
Honors Collegium,HNRS,Imagining Global Climate Change,146,{1827}
Honors Collegium,HNRS,Importance of Being an Ignorant Failure,19,{5860185}
Honors Collegium,HNRS,Interaction of Science and Society,14,{1044}
Honors Collegium,HNRS,Journal Club Seminars,193A,"{694,5860240,1597,1147,1253,641,5860191}"
Honors Collegium,HNRS,Justice and Moral Responsibility in Literature,158,{5858210}
Honors Collegium,HNRS,Leading Undergraduate Seminars,101E,"{5862684,5862721,190,1930}"
Honors Collegium,HNRS,"Life, Death, and Everything in Between",8,{5860246}
Honors Collegium,HNRS,Mellon Mays Research Seminar,101J,"{1994,5867124}"
Honors Collegium,HNRS,Mental Illness and Movies,19,"{5860827,5860830,986,5860839,5860857}"
Honors Collegium,HNRS,"Midwives, Mothers, and Medicine: Perspectives on History of Childbirth",124,{5860842}
Honors Collegium,HNRS,Mindful Awareness and Transformative Power of Attention,19,{2595}
Honors Collegium,HNRS,Past People and Their Lessons for Our Own Future,M152,{2604}
Honors Collegium,HNRS,Philanthropy as Civic Engagement,M123,"{5867114,3639}"
Honors Collegium,HNRS,"Poetry and Society in England, 1588 to 1688: Verse, Politics, Religion, and Sexuality from Spanish Armada to Glorious Revolution",115,{3397}
Honors Collegium,HNRS,Postmodern Culture,11W,{1431}
Honors Collegium,HNRS,"Preparing for Post-UCLA Success: Fellowships, Graduate School, and More",101K,{5866405}
Honors Collegium,HNRS,Privacy versus National Security,165,{3526}
Honors Collegium,HNRS,Racial and Ethnic Disparities in Healthcare,105,{1473}
Honors Collegium,HNRS,Research in Psychology and Legacy of John Wooden,129,{3952}
Honors Collegium,HNRS,"Research Today: Sources, Tools, and Strategies",101I,{823}
Honors Collegium,HNRS,Sampling and Remix: Aesthetics and Politics of Cultural Appropriation,37W,{1063}
Honors Collegium,HNRS,Shakespeare's History Plays,19,"{29,2381}"
Honors Collegium,HNRS,Solo Performer's Toolbox: Storytelling for Artists and TED Talkers,150,{5862682}
Honors Collegium,HNRS,Speeding the Cure: Can Activists Make a Difference?,130,{885}
Honors Collegium,HNRS,Student Research Forum,101A,"{1003,1774,3156}"
Honors Collegium,HNRS,"UCLA Centennial Initiative: Humanities, Arts, and Social Sciences Research Revealed",19,{5064}
Honors Collegium,HNRS,UCLA Centennial Initiative: Who Are We - Evolution of Student Body,19,{5860189}
Honors Collegium,HNRS,UCLA Undergraduate Journal for Humanities and Social Sciences,101C,"{5867160,3352}"
Honors Collegium,HNRS,UCLA Undergraduate Science Journal,101B,{2200}
Honors Collegium,HNRS,Undocu-Poster Project,19,{5274}
Honors Collegium,HNRS,"We Could Be Heroes: Race, Gender, and the Contemporary Hero Narrative",24,{1133}
Honors Collegium,HNRS,Welcome to Dark Side: Human Pathology in World Literature,4,{5860836}
Honors Collegium,HNRS,"Worlds of Neil Gaiman: Graphic Novels, Social Media, and Fantasy Fiction",87W,{2824}
Human Genetics,HUM GEN,Advanced Human Genetics A: Molecular Aspects,236A,{5861813}
Human Genetics,HUM GEN,Computational Methods in Genomics,M265,{2286}
Human Genetics,HUM GEN,Introduction to Bioinformatics,M260A,{5861733}
Human Genetics,HUM GEN,Machine Learning Applications in Genetics,CM124,{509}
Human Genetics,HUM GEN,Machine Learning Applications in Genetics,CM224,{1677}
Human Genetics,HUM GEN,Machine Learning in Bioinformatics,M226,{5861237}
Human Genetics,HUM GEN,Stochastic Models in Biology,M203,{3221}
Human Genetics,HUM GEN,Theoretical Genetic Modeling,M207A,{279}
Human Genetics,HUM GEN,Topics on Scientific Careers,282,{3278}
Hungarian,HNGAR,Elementary Hungarian,101A,{5862617}
Hungarian,HNGAR,Elementary Hungarian,101B,{1996587}
Indigenous Languages of the Americas,IL AMER,Advanced Nahuatl,M115A,{5861491}
Indigenous Languages of the Americas,IL AMER,Advanced Nahuatl,M115B,{1757}
Indigenous Languages of the Americas,IL AMER,Elementary Nahuatl,M5A,{5862262}
Indigenous Languages of the Americas,IL AMER,Elementary Nahuatl,M5B,{2643}
Indigenous Languages of the Americas,IL AMER,Elementary Quechua,18A,{5860576}
Indigenous Languages of the Americas,IL AMER,Elementary Quechua,18B,{3020}
Indigenous Languages of the Americas,IL AMER,Intermediate Nahuatl,M15A,{5862231}
Indigenous Languages of the Americas,IL AMER,Intermediate Nahuatl,M15B,{587}
Indo-European Studies,I E STD,Indo-European Comparative Mythology and Poetics,C160,{5858418}
Indo-European Studies,I E STD,Indo-European Comparative Mythology and Poetics,C260,{5858389}
Indo-European Studies,I E STD,Old Iranian,M230A,{5858406}
Indo-European Studies,I E STD,Old Iranian,M230B,{732}
Indo-European Studies,I E STD,Seminar: Indo-European Linguistics: Ancestral State Estimation in Indo-European and Beyond,280A,{845}
Indo-European Studies,I E STD,Seminar: Indo-European Linguistics: Introductory Luwian,280B,{395}
Indo-European Studies,I E STD,Seminar: Indo-European Linguistics: Seminar 1  ,281A,{1901}
Indo-European Studies,I E STD,Vedic,M222A,{5858405}
Indo-European Studies,I E STD,Vedic,M222B,{1123}
Indonesian,INDO,Advanced Indonesian,100A,{5864646}
Indonesian,INDO,Advanced Indonesian,100B,{1794}
Indonesian,INDO,Intermediate Indonesian,4,{5864687}
Indonesian,INDO,Intermediate Indonesian,5,{2016}
Indonesian,INDO,Introductory Indonesian,1,{5864677}
Indonesian,INDO,Introductory Indonesian,2,{3111}
Information Studies,INF STD,Advanced Honors Seminars: Seminar 1  ,189,{760}
Information Studies,INF STD,Archival Use and Users,434,{5864089}
Information Studies,INF STD,"Archives, Records, and Memory",431,{5860773}
Information Studies,INF STD,Artifacts and Cultures,211,"{5864233,5864216}"
Information Studies,INF STD,Current Issues in Librarianship,213,{1964}
Information Studies,INF STD,Data Management and Practice,262A,{3557}
Information Studies,INF STD,Description and Access,260,"{5864795,5864773}"
Information Studies,INF STD,Descriptive Cataloging,461,{1676}
Information Studies,INF STD,Digital Cultures and Societies,20,{3994}
Information Studies,INF STD,Digital Preservation,241,{2109}
Information Studies,INF STD,Doctoral Seminar: Research Methods and Design,298A,{5865749}
Information Studies,INF STD,Doctoral Seminar: Theoretical Traditions in Information Studies,291A,{5864794}
Information Studies,INF STD,"Environmental Protection of Collections for Museums, Libraries, and Archives",M238,{2658}
Information Studies,INF STD,Fieldwork in Libraries or Information Organizations,497,"{5867264,3911,3440,5867316,5867450,4625,5867411,3918,5867344,5867293,3600,3864,3442,5867369,5211}"
Information Studies,INF STD,Historical Methodology of Information Studies,281,{4814}
Information Studies,INF STD,History of Books and Literacy Technologies,202,{2128}
Information Studies,INF STD,Human/Computer Interaction,272,{5158}
Information Studies,INF STD,Information and Power,10,{1203}
Information Studies,INF STD,Information Services in Culturally Diverse Communities,227,{5866380}
Information Studies,INF STD,Internet and Society,30,{5863472}
Information Studies,INF STD,Internship,498,"{1050,5863437}"
Information Studies,INF STD,Introduction to Computer Systems and Programming,271,{5866489}
Information Studies,INF STD,Introduction to Media Archiving and Preservation,480,{566}
Information Studies,INF STD,Issues and Problems in Preservation of Heritage Materials,432,{5864261}
Information Studies,INF STD,Letterpress Laboratory,139,{582}
Information Studies,INF STD,Letterpress Laboratory,239,{2976}
Information Studies,INF STD,Management of Digital Records,240,{3059}
Information Studies,INF STD,Medical Decision Making,M255,{3903}
Information Studies,INF STD,Medical Information Infrastructures and Internet Technologies,M254,{5866663}
Information Studies,INF STD,Professional Development and Portfolio Design,400,{830}
Information Studies,INF STD,Public Libraries,423,{5865382}
Information Studies,INF STD,Research Seminar: Information Studies,290,"{3584,5866394}"
Information Studies,INF STD,Seminar: Advanced Issues in Archival Science--Archival Description and Access Systems,438B,{2910}
Information Studies,INF STD,Seminar: Special Issues in Information Studies: Audio Archiving,289,{5864110}
Information Studies,INF STD,Seminar: Special Issues in Information Studies: Data Informatics,289,{5866372}
Information Studies,INF STD,Seminar: Special Issues in Information Studies: Diverse Children's Literature,289,{3823}
Information Studies,INF STD,Seminar: Special Issues in Information Studies: Media Description and Access,289,{5866349}
Information Studies,INF STD,"Seminar: Special Issues in Information Studies: Migrating Memories: Diaspora, Archives, and Human Rights",289,{3425}
Information Studies,INF STD,Seminar: Special Issues in Information Studies: Moving Image Technology,289,{4700}
Information Studies,INF STD,Seminar: Special Issues in Information Studies: Sustainability and Information Professions,289,{5864067}
Information Studies,INF STD,Social Science Research Methodology for Information Studies,280,{5865743}
Information Studies,INF STD,Special Topics in Information Studies: Algorithms and Activism,180,{512}
Information Studies,INF STD,Special Topics in Information Studies: Lecture 2  ,180,{2478}
Information Studies,INF STD,Special Topics in Methodology of Information Studies: Critical Theory and LIS,298B,{5402}
Information Studies,INF STD,Special Topics in Theory of Information Studies,291B,{4063}
Information Studies,INF STD,Storytelling,424,{5864129}
Information Studies,INF STD,Systems and Infrastructures,270,"{1898,2012}"
Information Studies,INF STD,Teaching Assistant Training Seminar,495,"{5866653,2979}"
International and Area Studies,I A STD,Advanced Nahuatl,M115A,{5866123}
International and Area Studies,I A STD,Advanced Nahuatl,M115B,{538}
International and Area Studies,I A STD,Art of Citizen Diplomacy,111A,{1213}
International and Area Studies,I A STD,Elementary Amharic,M6A,{5864138}
International and Area Studies,I A STD,Elementary Amharic,M6B,{2539}
International and Area Studies,I A STD,Elementary Nahuatl,M5A,{5862523}
